{
  "$schema": "https://json-schema.org/draft/2020-12/schema",
  "type": "object",
  "properties": {
    "schemaVersion": {
      "type": "string",
      "const": "event-card/1"
    },
    "id": {
      "type": "string",
      "pattern": "^(ufc|oktagon):event:[a-z0-9]+(?:-[a-z0-9]+)*$"
    },
    "org": {
      "type": "string",
      "enum": [
        "ufc",
        "oktagon"
      ]
    },
    "name": {
      "type": "string",
      "minLength": 1,
      "maxLength": 160
    },
    "venue": {
      "type": "string",
      "minLength": 1,
      "maxLength": 160
    },
    "startsAtLocal": {
      "type": "string",
      "format": "date-time",
      "pattern": "^(?:(?:\\d\\d[2468][048]|\\d\\d[13579][26]|\\d\\d0[48]|[02468][048]00|[13579][26]00)-02-29|\\d{4}-(?:(?:0[13578]|1[02])-(?:0[1-9]|[12]\\d|3[01])|(?:0[469]|11)-(?:0[1-9]|[12]\\d|30)|(?:02)-(?:0[1-9]|1\\d|2[0-8])))T(?:(?:[01]\\d|2[0-3]):[0-5]\\d(?::[0-5]\\d(?:\\.\\d+)?)?(?:Z|([+-](?:[01]\\d|2[0-3]):[0-5]\\d)))$"
    },
    "timeZone": {
      "type": "string",
      "minLength": 1,
      "maxLength": 80
    },
    "startsAtUtc": {
      "type": "string",
      "format": "date-time",
      "pattern": "^(?:(?:\\d\\d[2468][048]|\\d\\d[13579][26]|\\d\\d0[48]|[02468][048]00|[13579][26]00)-02-29|\\d{4}-(?:(?:0[13578]|1[02])-(?:0[1-9]|[12]\\d|3[01])|(?:0[469]|11)-(?:0[1-9]|[12]\\d|30)|(?:02)-(?:0[1-9]|1\\d|2[0-8])))T(?:(?:[01]\\d|2[0-3]):[0-5]\\d(?::[0-5]\\d(?:\\.\\d+)?)?(?:Z|([+-](?:[01]\\d|2[0-3]):[0-5]\\d)))$"
    },
    "sourceRefs": {
      "minItems": 1,
      "type": "array",
      "items": {
        "type": "string",
        "minLength": 1
      }
    },
    "bouts": {
      "minItems": 1,
      "type": "array",
      "items": {
        "type": "object",
        "properties": {
          "id": {
            "type": "string",
            "minLength": 1,
            "maxLength": 160
          },
          "red": {
            "type": "string",
            "pattern": "^(ufc|oktagon):[a-z0-9]+(?:-[a-z0-9]+)*$"
          },
          "blue": {
            "type": "string",
            "pattern": "^(ufc|oktagon):[a-z0-9]+(?:-[a-z0-9]+)*$"
          },
          "division": {
            "type": "string",
            "minLength": 1,
            "maxLength": 80
          },
          "scheduledRounds": {
            "anyOf": [
              {
                "type": "number",
                "const": 3
              },
              {
                "type": "number",
                "const": 5
              }
            ]
          },
          "status": {
            "type": "string",
            "enum": [
              "announced",
              "weigh-in",
              "complete",
              "cancelled"
            ]
          }
        },
        "required": [
          "id",
          "red",
          "blue",
          "division",
          "scheduledRounds",
          "status"
        ],
        "additionalProperties": {}
      }
    },
    "updatedAt": {
      "type": "string",
      "format": "date-time",
      "pattern": "^(?:(?:\\d\\d[2468][048]|\\d\\d[13579][26]|\\d\\d0[48]|[02468][048]00|[13579][26]00)-02-29|\\d{4}-(?:(?:0[13578]|1[02])-(?:0[1-9]|[12]\\d|3[01])|(?:0[469]|11)-(?:0[1-9]|[12]\\d|30)|(?:02)-(?:0[1-9]|1\\d|2[0-8])))T(?:(?:[01]\\d|2[0-3]):[0-5]\\d(?::[0-5]\\d(?:\\.\\d+)?)?(?:Z|([+-](?:[01]\\d|2[0-3]):[0-5]\\d)))$"
    }
  },
  "required": [
    "schemaVersion",
    "id",
    "org",
    "name",
    "venue",
    "startsAtLocal",
    "timeZone",
    "startsAtUtc",
    "sourceRefs",
    "bouts",
    "updatedAt"
  ],
  "additionalProperties": {},
  "$id": "https://boardless.ai/contracts/event-card.schema.json"
}
